{
  "$schema": "http://json-schema.org/draft-07/schema#",
  "title": "Trip Companion Itinerary",
  "type": "object",
  "required": [
    "trip",
    "days"
  ],
  "properties": {
    "version": {
      "type": "integer",
      "default": 1
    },
    "trip": {
      "type": "object",
      "required": [
        "title",
        "startDate",
        "endDate"
      ],
      "properties": {
        "title": {
          "type": "string"
        },
        "subtitle": {
          "type": "string"
        },
        "startDate": {
          "type": "string",
          "description": "YYYY-MM-DD"
        },
        "endDate": {
          "type": "string",
          "description": "YYYY-MM-DD"
        },
        "timezone": {
          "type": "string",
          "description": "IANA tz, e.g. Asia/Bangkok"
        },
        "currency": {
          "type": "string"
        },
        "travellers": {
          "type": "array",
          "items": {
            "type": "string"
          }
        },
        "coverImage": {
          "$ref": "#/definitions/image",
          "description": "Hero photo for the trip card on the home screen"
        },
        "attachments": {
          "$ref": "#/definitions/attachments",
          "description": "Trip-wide documents (passport scan, insurance, visa) shown under Trip info"
        }
      }
    },
    "stays": {
      "type": "array",
      "items": {
        "type": "object",
        "required": [
          "id",
          "name"
        ],
        "properties": {
          "id": {
            "type": "string"
          },
          "name": {
            "type": "string"
          },
          "city": {
            "type": "string"
          },
          "address": {
            "type": "string"
          },
          "checkIn": {
            "type": "string"
          },
          "checkOut": {
            "type": "string"
          },
          "phone": {
            "type": "string"
          },
          "confirmation": {
            "type": "string"
          },
          "notes": {
            "type": "string"
          },
          "location": {
            "$ref": "#/definitions/location"
          },
          "image": {
            "$ref": "#/definitions/image",
            "description": "Photo of the hotel or resort"
          },
          "attachments": {
            "$ref": "#/definitions/attachments",
            "description": "Booking confirmation or voucher PDFs for this stay"
          }
        }
      }
    },
    "days": {
      "type": "array",
      "items": {
        "type": "object",
        "required": [
          "date"
        ],
        "properties": {
          "date": {
            "type": "string",
            "description": "YYYY-MM-DD"
          },
          "base": {
            "type": "string",
            "description": "City or region label shown in the date strip"
          },
          "title": {
            "type": "string"
          },
          "summary": {
            "type": "string"
          },
          "stayId": {
            "type": "string",
            "description": "id of an entry in stays[]"
          },
          "notes": {
            "type": "array",
            "items": {
              "type": "string"
            }
          },
          "items": {
            "type": "array",
            "items": {
              "type": "object",
              "required": [
                "title"
              ],
              "properties": {
                "time": {
                  "type": "string",
                  "description": "HH:MM, or free text like 'Morning'"
                },
                "endTime": {
                  "type": "string"
                },
                "title": {
                  "type": "string"
                },
                "type": {
                  "type": "string",
                  "enum": [
                    "sight",
                    "food",
                    "travel",
                    "flight",
                    "hotel",
                    "activity",
                    "rest",
                    "note"
                  ],
                  "default": "activity"
                },
                "description": {
                  "type": "string"
                },
                "cost": {
                  "type": "string"
                },
                "booking": {
                  "type": "object",
                  "properties": {
                    "ref": {
                      "type": "string"
                    },
                    "url": {
                      "type": "string"
                    }
                  }
                },
                "location": {
                  "$ref": "#/definitions/location"
                },
                "images": {
                  "$ref": "#/definitions/images",
                  "description": "One or more photos shown inside the schedule block"
                },
                "attachments": {
                  "$ref": "#/definitions/attachments",
                  "description": "Documents for this block: flight ticket, show ticket, tour voucher"
                }
              }
            }
          },
          "image": {
            "$ref": "#/definitions/image",
            "description": "Hero photo shown at the top of the day"
          }
        }
      }
    },
    "info": {
      "type": "array",
      "items": {
        "type": "object",
        "required": [
          "title",
          "body"
        ],
        "properties": {
          "title": {
            "type": "string"
          },
          "body": {
            "type": "string"
          },
          "image": {
            "$ref": "#/definitions/image"
          }
        }
      }
    },
    "contacts": {
      "type": "array",
      "items": {
        "type": "object",
        "required": [
          "label",
          "value"
        ],
        "properties": {
          "label": {
            "type": "string"
          },
          "value": {
            "type": "string"
          },
          "type": {
            "type": "string",
            "enum": [
              "phone",
              "url",
              "text"
            ],
            "default": "text"
          }
        }
      }
    },
    "emergency": {
      "type": "object",
      "description": "Emergency contacts and embassy / hospital locations shown first on Trip info",
      "properties": {
        "contacts": {
          "type": "array",
          "items": {
            "type": "object",
            "required": ["label", "value"],
            "properties": {
              "label": { "type": "string" },
              "value": { "type": "string" },
              "type": {
                "type": "string",
                "enum": ["phone", "url", "text"],
                "default": "phone"
              }
            }
          }
        },
        "locations": {
          "type": "array",
          "items": {
            "type": "object",
            "properties": {
              "label": { "type": "string", "description": "e.g. Embassy, Hospital" },
              "name": { "type": "string" },
              "address": { "type": "string" },
              "phone": { "type": "string" },
              "notes": { "type": "string" },
              "location": { "$ref": "#/definitions/location" }
            }
          }
        }
      }
    }
  },
  "definitions": {
    "location": {
      "type": "object",
      "properties": {
        "name": {
          "type": "string"
        },
        "address": {
          "type": "string"
        },
        "lat": {
          "type": "number"
        },
        "lng": {
          "type": "number"
        },
        "placeId": {
          "type": "string",
          "description": "Google Place ID, optional"
        },
        "googleMapsUrl": {
          "type": "string",
          "description": "Overrides generated URL if present"
        }
      }
    },
    "image": {
      "description": "Either a bare https URL string, or an object with url plus optional caption and credit.",
      "oneOf": [
        {
          "type": "string",
          "format": "uri"
        },
        {
          "type": "object",
          "required": [
            "url"
          ],
          "properties": {
            "url": {
              "type": "string",
              "format": "uri"
            },
            "caption": {
              "type": "string"
            },
            "credit": {
              "type": "string"
            }
          }
        }
      ]
    },
    "images": {
      "oneOf": [
        {
          "$ref": "#/definitions/image"
        },
        {
          "type": "array",
          "items": {
            "$ref": "#/definitions/image"
          }
        }
      ]
    },
    "attachment": {
      "description": "A linked document. Either a bare https URL string, or an object with url plus optional title, kind and note. Tapping it hands the URL to the phone, so a PDF opens in the device PDF viewer.",
      "oneOf": [
        {
          "type": "string",
          "format": "uri"
        },
        {
          "type": "object",
          "required": [
            "url"
          ],
          "properties": {
            "url": {
              "type": "string",
              "format": "uri"
            },
            "title": {
              "type": "string",
              "description": "Row label. Falls back to the file name when omitted."
            },
            "kind": {
              "type": "string",
              "enum": [
                "pdf",
                "image",
                "doc",
                "ticket",
                "link"
              ],
              "description": "Icon and badge. Inferred from the file extension when omitted."
            },
            "note": {
              "type": "string",
              "description": "Small secondary line, e.g. a confirmation number"
            }
          }
        }
      ]
    },
    "attachments": {
      "oneOf": [
        {
          "$ref": "#/definitions/attachment"
        },
        {
          "type": "array",
          "items": {
            "$ref": "#/definitions/attachment"
          }
        }
      ]
    }
  }
}
